{
    "maxAngleVar": 10,
    "angleVarDamp": 6,
    "angleVarPerShot": 2,
    "timeBetweenShots": 0.1,
    "reloadTime": 0.5,
    "price": 800,
    "clipName": "caution:rbcClip",
    "gunLength": 0.14,
    "displayName": "RBC Machine Gun",
    "lightOnShot": true,
    "shootSounds": [
        "core:waveGun"
    ],
    "reloadSounds": [
        "core:gunReload"
    ]
}
