{
  "fixed": false,
  "maxAngleVar": 0,
  "angleVarDamp": 0,
  "angleVarPerShot": 0,
  "timeBetweenShots": -10,
  "reloadTime": 0.1,
  "price": 1000000,
  "clipName": "tribe:laserClip",
  "gunLength": 0.5,
  "displayName": "Laser",
  "lightOnShot": true,
  "shootSounds": [
    "core:waveGun"
  ],
  "reloadSounds": [
    "core:gunReload"
  ]
}
